<?xml version="1.0" encoding="UTF-8"?>
<addml xmlns="http://www.arkivverket.no/standarder/addml"
	   xmlns:xsi="http://www.w3.org/2001/XMLSchema-instance"
	   name="Noark 5-arkivuttrekk"
	   xsi:schemaLocation="http://www.arkivverket.no/standarder/addml addml.xsd">

	<!--
	
	Endringer i malen
	
	2013-03-13 - Endringer fra Noark 5 versjon 3.0 til versjon 3.1:
	1. Løpende journal (loependeJournal)
	   - Rettet fra registrering til journalregistrering under info
	2. Offentlig journal (offentligJournal)
	   - Rettet fra registrering til journalregistrering under info
	3. Endret navnet på malfilen til arkivuttrekk_Noark_5_v_3_1_mal.xml
	4. Endret første dataobjekts tittel fra "Noark 5 arkivuttrekk" til "Noark 5-arkivuttrekk"
	5. Endret egenskapen version i første dataobjekt fra "3.0" til "3.1"

  -->

	<dataset>
		<description>Noark 5-arkivuttrekk</description>
		<reference>
			<context>
				<additionalElements>
					<additionalElement name="recordCreators">
						<additionalElements>
							<additionalElement name="recordCreator"><value>Lewis Caroll</value></additionalElement>
						</additionalElements>
					</additionalElement>
					<additionalElement name="systemType">
						<value>Sakarkiv (Noark-5)</value>
					</additionalElement>
					<additionalElement name="systemName">
						<value>Utrolig dårlig arkiv</value>
					</additionalElement>
					<additionalElement name="archive">
						<value>Alice in wonderland</value>
					</additionalElement>
				</additionalElements>
			</context>
			<content>
				<additionalElements>
					<additionalElement name="archivalPeriod">
						<properties>
							<property name="startDate">
								<value>1863-03-27</value>
							</property>
							<property name="endDate">
								<value>1865-12-11</value>
							</property>
						</properties>
					</additionalElement>
				</additionalElements>
			</content>
		</reference>
		<dataObjects>
			<dataObject name="Noark 5-arkivuttrekk">
				<properties>
					<property name="info">
						<properties>
							<property name="type">
								<value>Noark 5</value>
								<properties>
									<property name="version">
										<value>3.1</value>
									</property>
								</properties>
							</property>
							<property name="additionalInfo">
								<properties>
									<property name="periode">
										<properties>
											<property name="inngaaendeSkille">
												<value>skarp</value>
											</property>
											<property name="utgaaendeSkille">
												<value>skarp</value>
											</property>
										</properties>
									</property>
									<property dataType="boolean" name="inneholderSkjermetInformasjon">
										<value>true</value>
									</property>
									<property dataType="boolean" name="omfatterDokumenterSomErKassert">
										<value>true</value>
									</property>
									<property dataType="boolean" name="inneholderDokumenterSomSkalKasseres">
										<value>true</value>
									</property>
									<property dataType="boolean" name="inneholderVirksomhetsspesifikkeMetadata">
										<value>true</value>
									</property>
									<property dataType="integer" name="antallDokumentfiler">
										<value>2</value>
									</property>
								</properties>
							</property>
						</properties>
					</property>
				</properties>
				<dataObjects>
					<dataObject name="arkivstruktur">
						<properties>
							<property name="file">
								<properties>
									<property name="name">
										<value>arkivstruktur.xml</value>
									</property>
									<property name="format">
										<value>XML</value>
										<properties>
											<property name="version">
												<value>1.0</value>
											</property>
										</properties>
									</property>
									<property name="checksum">
										<properties>
											<property name="algorithm">
												<value>SHA-256</value>
											</property>
											<property name="value">
												<value>000CDCA105BD9722759FF81BCB2977E09E6A9A473735CCC540866989444198A2</value>
											</property>
										</properties>
									</property>
								</properties>
							</property>
							<property name="schema">
								<value>main</value>
								<properties>
									<property name="file">
										<properties>
											<property name="name">
												<value>arkivstruktur.xsd</value>
											</property>
											<property name="format">
												<value>XML</value>
												<properties>
													<property name="version">
														<value>1.0</value>
													</property>
												</properties>
											</property>
											<property name="checksum">
												<properties>
													<property name="algorithm">
														<value>SHA-256</value>
													</property>
													<property name="value">
														<value>B89DA6C744A8559A2311CEF78C966B4BE9497ECB62C08FC7E9D3B9AE1569E3CE</value>
													</property>
												</properties>
											</property>
										</properties>
									</property>
									<property name="type">
										<value>XML Schema</value>
										<properties>
											<property name="version">
												<value>1.0</value>
											</property>
										</properties>
									</property>
								</properties>
							</property>
							<property name="schema">
								<properties>
									<property name="file">
										<properties>
											<property name="name">
												<value>metadatakatalog.xsd</value>
											</property>
											<property name="format">
												<value>XML</value>
												<properties>
													<property name="version">
														<value>1.0</value>
													</property>
												</properties>
											</property>
											<property name="checksum">
												<properties>
													<property name="algorithm">
														<value>SHA-256</value>
													</property>
													<property name="value">
														<value>29CAB7473ED02BB0DC2B1B7EC7573CD60C1C1C2141439AF3B4AF883F454C86B4</value>
													</property>
												</properties>
											</property>
										</properties>
									</property>
									<property name="type">
										<value>XML Schema</value>
										<properties>
											<property name="version">
												<value>1.0</value>
											</property>
										</properties>
									</property>
								</properties>
							</property>
							<property name="info">
								<properties>
									<property name="numberOfOccurrences">
										<value>mappe</value>
										<properties>
											<property name="elementPath">
												<value>//mappe</value>
											</property>
											<property dataType="integer" name="value">
												<value>1</value>
											</property>
										</properties>
									</property>
									<property name="numberOfOccurrences">
										<value>registrering</value>
										<properties>
											<property name="elementPath">
												<value>//registrering</value>
											</property>
											<property dataType="integer" name="value">
												<value>2</value>
											</property>
										</properties>
									</property>
								</properties>
							</property>
						</properties>
					</dataObject>
				</dataObjects>
			</dataObject>
		</dataObjects>
	</dataset>
</addml>